{
  "$schema": "https://json-schema.org/draft/2020-12/schema",
  "$id": "token.schema.json",
  "title": "Token",
  "description": "One row of the `tokens` table: a Pump.fun (or other launchpad) token seen by the collector, with the creator wallet address resolved. Source: backend/migrations/0001_init.sql, 0004, 0010; collectors/pumpportal.py.",
  "type": "object",
  "required": ["id", "chain", "mint", "first_seen_at", "source"],
  "additionalProperties": false,
  "properties": {
    "id": { "type": "integer", "description": "Primary key (`tokens.id`)." },
    "chain": { "type": "string", "description": "Chain name; `SOLANA` today. Unique together with `mint`.", "examples": ["SOLANA"] },
    "mint": { "type": "string", "description": "Token mint address (base58). Pump.fun mints usually end in `pump`." },
    "name": { "type": ["string", "null"], "description": "Token name from the creation event." },
    "symbol": { "type": ["string", "null"], "description": "Ticker." },
    "uri": { "type": ["string", "null"], "description": "Metadata URI from the creation event (IPFS or the launcher's own host)." },
    "launchpad": { "type": ["string", "null"], "description": "Launchpad (`pool` field of PumpPortal), e.g. `pump` or `bonk`." },
    "creator_wallet_id": { "type": ["integer", "null"], "description": "`wallets.id` of the creator. The public address is in `creator_wallet`." },
    "creator_wallet": { "type": ["string", "null"], "description": "Derived field, not a column: `wallets.address` of `creator_wallet_id`. Public on-chain address." },
    "bonding_curve": { "type": ["string", "null"], "description": "Bonding curve account address." },
    "create_signature": { "type": ["string", "null"], "description": "Signature of the creation transaction." },
    "created_at": { "type": ["string", "null"], "format": "date-time", "description": "Creation time. PumpPortal events carry no block time, so this is the time the collector received the creation event (or the first event it saw for the mint). It can be later than the real creation, e.g. for tokens first seen at migration." },
    "initial_buy_sol": { "type": ["number", "null"], "description": "SOL the creator spent in the creation transaction." },
    "initial_market_cap_sol": { "type": ["number", "null"], "description": "Market cap in SOL at creation." },
    "migrated_at": { "type": ["string", "null"], "format": "date-time", "description": "When the token left the bonding curve for a pool." },
    "migration_pool": { "type": ["string", "null"], "description": "Pool it migrated to, e.g. `pump-amm` or `raydium-cpmm`." },
    "metadata": { "type": ["object", "null"], "description": "Free-form jsonb for pipeline flags (for example `helius_creation_checked`).", "additionalProperties": true },
    "first_seen_at": { "type": "string", "format": "date-time", "description": "When Kairos first stored this token." },
    "source": { "type": "string", "description": "Where the token came from: `pumpportal` (live stream) or `frontrun_ca_history` (found through a shiller's CA history).", "examples": ["pumpportal", "frontrun_ca_history"] },
    "trades_synced_until": { "type": ["string", "null"], "format": "date-time", "description": "Trades are loaded (Helius) up to this time. A horizon is judged only when its end is not later than this." },
    "trades_backfill_truncated": { "type": "boolean", "description": "The per-token credit cap stopped the trade backfill before the start of history." },
    "narrative": { "type": ["string", "null"], "description": "Theme guessed from name and ticker without external APIs (e.g. `dog`, `ai`, `politics`, `other`); null until classified." },
    "narrative_version": { "type": ["integer", "null"], "description": "Version of the narrative classifier that wrote `narrative`." }
  }
}
