{
  "id": 62582,
  "uri": "https://ipfs.io/ipfs/bafkreigwl7udfrvdugoyzdy4w5k7cxgrasylpdyuqjowabl65thzsim5he",
  "mint": "944fTeZPkMwdUp6yWmuk9Q9uUt44MEuerY3Efjfhpump",
  "name": "Super Wif Inu",
  "chain": "SOLANA",
  "source": "pumpportal",
  "symbol": "WIFSI",
  "metadata": {
    "helius_creation_checked": true
  },
  "launchpad": "pump",
  "narrative": "dog",
  "created_at": "2026-10-20T17:20:54+00:00",
  "migrated_at": "2026-10-20T17:20:54.654122+00:00",
  "bonding_curve": "8gCkfaWTEChTV7juBTCyovevAxLv5crhzKWA7Ln3KVVb",
  "first_seen_at": "2026-10-20T17:20:54.472333+00:00",
  "migration_pool": "pump-amm",
  "initial_buy_sol": 0.197500035,
  "create_signature": "5WrYxg72gefwQwdxx1eMspoz7VMHZxsBto1cWUdeiu536buxp2q4PRNENLJrkvrLd47LBAkbaFK4L2Ky2QXXURCL",
  "creator_wallet_id": 59861,
  "narrative_version": 1,
  "trades_synced_until": "2026-10-21T10:01:44+00:00",
  "initial_market_cap_sol": 28.328332,
  "trades_backfill_truncated": true,
  "creator_wallet": "81mrKGVUzzaEXwntF1pwgKjTic7kLt8UbYDWPrgqST7M"
}
